{
  "$schema": "https://json-schema.org/draft/2020-12/schema",
  "$id": "https://mldsafail.local/schemas/0.5.0/record.json",
  "type": "object",
  "required": [
    "run_id",
    "case_index",
    "repetition",
    "result"
  ],
  "properties": {
    "run_id": {},
    "case_index": {},
    "repetition": {},
    "result": {}
  },
  "additionalProperties": false
}
