{"case_index":33,"repetition":1,"result":{"candidate":{"s1":[[2,0,-1,2,1,-2,2,2],[0,2,1,2,2,0,2,0]],"s2":[[0,0,-1,2,-1,0,1,0],[1,0,0,-2,1,0,-2,-1]],"tag":"recovered_secret"},"cpu_seconds":0.008884919000000005,"diagnostic_counters":{},"docker_state":{"Dead":false,"Error":"","ExitCode":0,"FinishedAt":"2026-09-12T09:42:26.95918051Z","OOMKilled":false,"Paused":false,"Pid":0,"Restarting":false,"Running":false,"StartedAt":"2026-09-12T09:42:26.823777635Z","Status":"exited"},"evaluator_wall_seconds":0.1954594161361456,"exit_code":0,"input_digest":"99c16f949038ae58b9c7ddc120a4d36e3d9a2dcbf711053f7606dcca51dd1963","limits":{"cpu_affinity":0,"rlimits_applied":["RLIMIT_AS"]},"output_digest":"29667de6bbfd0e2c6dcedc70158b9274768b297fc73dc931ecd08dea0a0a22e4","output_overflow":false,"peak_rss_bytes":32059392,"phase_cpu_seconds":{},"solver_cpu_seconds":0.008681586000000005,"solver_parameters":{},"status":"success","stderr":"","stdout":"{\"candidate\":{\"s1\":[[2,0,-1,2,1,-2,2,2],[0,2,1,2,2,0,2,0]],\"s2\":[[0,0,-1,2,-1,0,1,0],[1,0,0,-2,1,0,-2,-1]],\"tag\":\"recovered_secret\"},\"cpu_seconds\":0.008884919000000005,\"diagnostic_counters\":{},\"limits\":{\"cpu_affinity\":0,\"rlimits_applied\":[\"RLIMIT_AS\"]},\"peak_rss_bytes\":32059392,\"phase_cpu_seconds\":{},\"solver_cpu_seconds\":0.008681586000000005,\"solver_parameters\":{},\"verification\":{\"failure_reason\":null,\"norm_infinity\":2,\"norm_squared\":57,\"verified\":true},\"verification_cpu_seconds\":8.38329999999915e-05,\"wall_seconds\":0.009258042002329603}","verification":{"failure_reason":null,"norm_infinity":2,"norm_squared":57,"verified":true},"verification_cpu_seconds":8.38329999999915e-05,"wall_seconds":0.009258042002329603},"run_id":"9012663797c246638df0d044b1064568"}
